Condition Name, Treatment Name, Condition Category, Citation URL, # Matches
abdominal adhesions, probiotics, Alternative Therapies, https://healthfully.com/1011994-alternative-medicine-ibs.html, 43
abdominal adhesions, hypnosis, Alternative Therapies, https://healthfully.com/1011994-alternative-medicine-ibs.html, 43
abdominal adhesions, treatment, Alternative Therapies, https://healthfully.com/1011994-alternative-medicine-ibs.html, 43
abdominal adhesions, acupuncture, Alternative Therapies, https://healthfully.com/1011994-alternative-medicine-ibs.html, 43
abdominal adhesions, lactobacillus, Alternative Therapies, https://healthfully.com/1011994-alternative-medicine-ibs.html, 43
abdominal adhesions, peppermint, Alternative Therapies, https://healthfully.com/1011994-alternative-medicine-ibs.html, 43
abdominal adhesions, yoga, Alternative Therapies, https://healthfully.com/1011994-alternative-medicine-ibs.html, 43
abdominal adhesions, lactase, Alternative Therapies, https://healthfully.com/1011994-alternative-medicine-ibs.html, 43
abdominal adhesions, meditation, Alternative Therapies, https://healthfully.com/1011994-alternative-medicine-ibs.html, 43
abdominal adhesions, aloe, Alternative Therapies, https://healthfully.com/1011994-alternative-medicine-ibs.html, 43
abdominal adhesions, avocado, Alternative Therapies, https://healthfully.com/1011994-alternative-medicine-ibs.html, 43
abdominal adhesions, saccharomyces boulardii, Alternative Therapies, https://healthfully.com/1011994-alternative-medicine-ibs.html, 43
abdominal adhesions, yogurt, Alternative Therapies, https://healthfully.com/1011994-alternative-medicine-ibs.html, 43
abdominal adhesions, tai chi, Alternative Therapies, https://healthfully.com/1011994-alternative-medicine-ibs.html, 43
abdominal adhesions, hypnotherapy, Alternative Therapies, https://healthfully.com/1011994-alternative-medicine-ibs.html, 43
abdominal adhesions, treatment, Food and Drinks, https://www.livestrong.com/article/411934-the-diet-for-bowel-adhesions/, 8
abdominal adhesions, brown rice, Food and Drinks, https://www.livestrong.com/article/411934-the-diet-for-bowel-adhesions/, 8
abdominal adhesions, yogurt, Food and Drinks, https://www.livestrong.com/article/411934-the-diet-for-bowel-adhesions/, 8
abdominal adhesions, vitamin e, Supplements, https://www.ncbi.nlm.nih.gov/pmc/articles/PMC3148472/, 148
abdominal adhesions, selenium, Supplements, https://www.ncbi.nlm.nih.gov/pmc/articles/PMC3148472/, 148
abdominal adhesions, glutathione, Supplements, https://www.ncbi.nlm.nih.gov/pmc/articles/PMC3148472/, 148
abdominal adhesions, melatonin, Supplements, https://www.ncbi.nlm.nih.gov/pmc/articles/PMC3148472/, 148
abdominal adhesions, treatment, Supplements, https://www.ncbi.nlm.nih.gov/pmc/articles/PMC3148472/, 148
abdominal adhesions, palm oil, Supplements, https://www.ncbi.nlm.nih.gov/pmc/articles/PMC3148472/, 148
abdominal adhesions, resveratrol, Supplements, https://www.ncbi.nlm.nih.gov/pmc/articles/PMC3148472/, 148
abdominal adhesions, honey, Supplements, https://www.ncbi.nlm.nih.gov/pmc/articles/PMC3148472/, 148
abdominal adhesions, iodine, Supplements, https://www.ncbi.nlm.nih.gov/pmc/articles/PMC3148472/, 148
abdominal adhesions, olive, Supplements, https://www.ncbi.nlm.nih.gov/pmc/articles/PMC3148472/, 148
abdominal adhesions, superoxide dismutase, Supplements, https://www.ncbi.nlm.nih.gov/pmc/articles/PMC3148472/, 148
abdominal adhesions, probiotics, Alternative Therapies, https://healthfully.com/1011994-alternative-medicine-ibs.html, 43
abdominal adhesions, hypnosis, Alternative Therapies, https://healthfully.com/1011994-alternative-medicine-ibs.html, 43
abdominal adhesions, treatment, Alternative Therapies, https://healthfully.com/1011994-alternative-medicine-ibs.html, 43
abdominal adhesions, acupuncture, Alternative Therapies, https://healthfully.com/1011994-alternative-medicine-ibs.html, 43
abdominal adhesions, lactobacillus, Alternative Therapies, https://healthfully.com/1011994-alternative-medicine-ibs.html, 43
abdominal adhesions, peppermint, Alternative Therapies, https://healthfully.com/1011994-alternative-medicine-ibs.html, 43
abdominal adhesions, yoga, Alternative Therapies, https://healthfully.com/1011994-alternative-medicine-ibs.html, 43
abdominal adhesions, lactase, Alternative Therapies, https://healthfully.com/1011994-alternative-medicine-ibs.html, 43
abdominal adhesions, meditation, Alternative Therapies, https://healthfully.com/1011994-alternative-medicine-ibs.html, 43
abdominal adhesions, aloe, Alternative Therapies, https://healthfully.com/1011994-alternative-medicine-ibs.html, 43
abdominal adhesions, avocado, Alternative Therapies, https://healthfully.com/1011994-alternative-medicine-ibs.html, 43
abdominal adhesions, saccharomyces boulardii, Alternative Therapies, https://healthfully.com/1011994-alternative-medicine-ibs.html, 43
abdominal adhesions, yogurt, Alternative Therapies, https://healthfully.com/1011994-alternative-medicine-ibs.html, 43
abdominal adhesions, tai chi, Alternative Therapies, https://healthfully.com/1011994-alternative-medicine-ibs.html, 43
abdominal adhesions, hypnotherapy, Alternative Therapies, https://healthfully.com/1011994-alternative-medicine-ibs.html, 43
